cv_id,candidate_name,email,phone,candidate_text,recommendation
13,Not Provided,Not Provided,Not Provided,"The candidate is a dependable Computer Application Analyst with comprehensive experience in diagnosing and troubleshooting network, hardware, and desktop issues. They have a strong background in tracking and evaluating IT infrastructure incidents and possess diverse industry experience in health care and government. Their expertise includes systems applications, technical helpdesk experience, information protection analysis, and on-call troubleshooting in distributed multi-tier environments. They have advanced skills in using Epic medical software to register patients and train doctors and nurses on inputting medical information into the Epic system.

As a member of the Epic Pelican Project team for LSU Medical Science Center, the candidate contributed to the successful implementation of the domain system at FMOL Health System and worked with the Epic software Go-Live team to troubleshoot issues. They acted as the lead Application Analyst for LSU Medical Science.

In their current role as a Patient Access Representative since March 2015, they are responsible for obtaining complete and accurate demographic information and entering data thoroughly on patients. They notify patients of co-payments, deductibles, or deposits and train new employees on how to navigate the Epic software.

Previously, they worked as a Geek Squad Consultation Agent from June 2014 to March 2015, where they diagnosed and resolved clients' computer problems, upgraded hardware and software, and removed viruses and malware from clients' computers. They also served as a Technical Support Specialist from September 2013 to December 2013, demonstrating advanced product knowledge with AT&T products, managing a trouble ticket system, and providing courteous customer service.

As an EHR Application Analyst from October 2011 to March 2012, the candidate worked closely with medical staff to ensure Epic access, supported end users with technical issues, and troubleshot any arising problems. They provided primary technical support as a Computer Analyst from February 2009 to December 2011, training employees and setting up new accounts for doctors and staff. Additionally, they resolved computer desktop and laptop issues as a Computer Assistant/Functional Administrator from June 2001 to March 2007, leading team meetings and recommending new software to management as needed.

The candidate holds a Bachelor of Science degree in Computer Information Systems with a focus on Telecommunication Systems Support from Tulane University, obtained in 2008, and an Associate of Science degree in Computer Network Engineering from Delgado Community College, obtained in 2002. They are a veteran of the United States Navy with an honorable discharge.

Their technical skills include proficiency in system software such as Adobe Dreamweaver, Help Desk software, HTML, IBM Mainframes, and Microsoft Office applications. They have experience in network support, database management, and excellent communication skills, particularly in customer support and conflict resolution. The candidate is also a candidate for Project Management Professional (PMP) certification.","--- Evaluation Report ---
Job Title: IT Support Specialist

Candidate Fit Level: Strong Fit

Strengths:
- **Experience with Epic Systems**: The candidate has advanced skills in using Epic medical software, including training clinical staff on its use, which directly aligns with the job's requirement for experience with Epic Systems.
- **Healthcare Environment Background**: The candidate has diverse experience in healthcare settings, including roles that involved direct support for medical staff and systems, which is crucial for the position.
- **Technical Troubleshooting Skills**: They have comprehensive experience in diagnosing and resolving hardware and software issues, which is essential for providing technical assistance as outlined in the job description.
- **Training End-Users**: The candidate has a proven track record of training new employees and clinical staff on software systems, fulfilling the job's requirement for user training.
- **Communication Skills**: The candidate has demonstrated strong communication skills through their roles in customer support and conflict resolution, which is highly valued in the job description.

Missing or Weak Areas:
- **Specific Experience with EMR Systems**: While the candidate has experience with Epic, the job description mentions a broader scope of EMR systems. There is no explicit mention of familiarity with other EMR systems beyond Epic.
- **Network and Database Knowledge**: Although the candidate has experience in network support and database management, the job description emphasizes strong knowledge in these areas. More specific examples of their expertise in networks and databases would strengthen their fit.
- **Recent Experience in IT Support**: The candidate's most recent role as a Patient Access Representative may not fully align with the technical support focus of the IT Support Specialist role, which could raise questions about their current technical skills.

---------------------------"
11,Candidate Name,candidate.email@example.com,(123) 456-7890,"The candidate has extensive experience as an RN Staff Nurse from August 2008 to April 2014, where they participated in multidisciplinary plans of care, followed best practice protocols, and engaged in patient-centered and team-based care. They identified barriers to successful treatment and communicated these with the team, while also monitoring, measuring, and documenting the progress of interventions and outcomes. The candidate ensured timely and effective communication of newly implemented changes to unit-based methods of practice. Their accomplishments include being a certified instructor in Management of Aggressive Behavior (MOAB), serving as a Patient Experience Champion, chairing the Shared Governance Policy & Procedure Committee, obtaining Oncology Certification, and implementing unit bedside reports and hourly rounding. Their skills in this role included therapeutic touch and communication, teach-back communication, assessments, IV care, telemetry care, and wound care, including wound vacs and dressing changes. They demonstrated excellent organizational skills and maintained collaborative working relationships with unit team members, physicians, technicians, pharmacy, housekeeping, and other ancillary team members.

Prior to this, the candidate worked as an RN Resident Care Manager from July 2007 to July 2008, where they managed care for adult and senior patient populations. They possessed knowledge of various care levels, including SNF, ECF, ICF, ALF, rehab, and hospice. Their responsibilities included attending and participating in care conferences, developing and distributing expected outcomes to the interdisciplinary team, assigning and directing care provided by licensed staff across a 24-hour schedule, reconciling monthly MARs, disposing of outdated medications, and developing and monitoring appropriate care plans. They created and communicated a unit mission statement and developed an effective teamwork model for licensed staff and caregivers. The candidate utilized effective oral and written communication and organizational skills, determined and directed appropriate care, navigated electronic medical records, and provided compassionate communication to family members in times of crisis.

From July 2000 to June 2007, the candidate served as an RN Charge Nurse, where they assessed acuity, assigned staff, reviewed charts, and obtained and signed off orders. They provided guidance and monitoring to team members to balance workloads throughout shifts and participated in staff meetings and hospital-wide agendas. In the Geriatric Assessment Center (GAC), they performed total body assessments, including hearing, vision, and labs. Their accomplishments during this time included obtaining Geriatric Resource Nurse (GRN) certification from 2003 to 2008, being a hospital-based NICHE member, serving on the Pain Management Resource team, and participating in Evidence-Based Practice implementation. The candidate also worked as an Administrative Assistant from April 1990 to April 1996, where they maintained informational material, assisted applicants with application completion, compiled information for reports, set up and maintained supervised bank accounts, reconciled local office banking systems, serviced delinquent accounts, prepared tax vouchers, and ensured the weekly backup of computer files.

The candidate holds a Bachelor of Science in Nursing (BSN) from Washington State University, obtained in 2007, an Associate Degree in Nursing (ADN) from Clark College, completed in 2000, and an Associate of Arts in General Studies from Clark College, completed in 1987. They also have a background in Medical Administration from Western Business College, completed in 1982. Their skills encompass balance, banking, basic charting, oral and written communication, basic computer skills, conference participation, direction, instructional capabilities, organizational skills, and teamwork.","--- Evaluation Report ---
Job Title: IT Support Specialist

Candidate Fit Level: Not a Good Fit

Strengths:
- The candidate has extensive experience in healthcare environments, specifically as a Registered Nurse (RN), which provides them with a solid understanding of clinical workflows and the needs of healthcare staff.
- They have demonstrated strong communication skills through their roles, particularly in patient-centered care and interdisciplinary team collaboration.
- The candidate has experience navigating electronic medical records (EMR), which is relevant to the support of EMR systems mentioned in the job description.
- Their background in training and instructing staff (e.g., certified instructor in Management of Aggressive Behavior) indicates a capacity to train end-users, which is a requirement of the role.

Missing or Weak Areas:
- The candidate lacks direct experience with IT support, technical assistance, or troubleshooting hardware and software issues, which are crucial for the IT Support Specialist role.
- There is no mention of experience with Epic Systems or any specific EMR systems, which is a key requirement in the job description.
- The candidate does not demonstrate knowledge of networks and databases, which is important for resolving technical issues in an IT support context.
- Their experience is primarily clinical rather than technical, indicating a gap in the necessary IT skills and knowledge required for this position.

---------------------------"
6,Not Provided,Not Provided,Not Provided,"The candidate is an accomplished and results-oriented investment professional with strong leadership and interpersonal skills, adding energy and value to an organization's quest for excellence. They possess a comprehensive skill set that includes proficiency in Internet and Microsoft Office applications such as MS Word, MS PowerPoint, MS Excel, Pivot Tables, Spreadsheets, and Macros. Additionally, they are experienced with Business Objects, Lombardi, Eagle Accounting System, PEGA, DRAS, and Workbench. Their expertise extends to account reconciliations, variance analysis, and complex problem-solving, complemented by superior research skills and effective time management.

The candidate has received multiple awards for performance and has been formally recognized for excellence in financial analysis, budgeting, and forecasting. They increased the efficiency of discrepancy investigations by designing a more accurate cash-forecasting system.

In their professional experience, the candidate worked as an Investment Accountant from October 2012 to November 2015. In this role, they reconciled mutual fund accounts with custody, identified and resolved differences in custody and accounting cash, currency, and positions using Eagle, IAX, Business Objects, Lombardi, and Workbench Reports. They communicated and collaborated with various stakeholders, including clients, fund accountants, and custodians, to resolve outstanding items in cash, currency, and positions. The candidate conducted weekly client meetings and acted as a liaison between accounting and custody. They completed special projects as needed, trained and oversaw staff in the offshore team in Pune, India, and assisted in platform migration tests. They also ran daily reports for fund accountants using Business Objects and MS Database. Notably, they received special achievement awards at BNY Mellon Bank in Asset Servicing in December 2013 and December 2014.

Prior to this, the candidate served as an AML Compliance Officer from November 2011 to March 2012, where they audited customer bank accounts, performed quality assurance reviews, reconciled results on spreadsheets, and conducted background searches on clients using tools such as World Check and Google Search.

The candidate also participated in finance projects at the University of Delaware, including a group simulation project that developed an investment philosophy and strategy for a simulated investment of $1,000,000. They allocated funds across various investment types, performed analyses to minimize CV, and conducted regression analysis on weekly returns. They also engaged in case analysis on price momentum strategy, testing its effectiveness in the US stock market.

Earlier in their career, the candidate worked as a Medical Technologist from July 2008 to March 2012, gaining clinical microbiology experience that included ordering, processing, plating, and culturing patient specimens, as well as performing rapid and confirmatory tests to identify organisms.

The candidate holds a Master of Business Administration in Finance from the University of Delaware, obtained in 2011, and a Bachelor of Science in Medical Technology from the same institution, completed in 2008. Their related coursework includes Financial Reporting and Analysis, Financial Management, Corporate Financial Policies, Investment Analysis and Portfolio Management, Corporate Governance, and Financial Engineering and Risk Management (Derivatives).

They are proficient in English, Marathi, Hindi, and Gujarati, and possess excellent multitasking, analytical thinking, time management, negotiation, communication, organization, and leadership skills. Their technical skills include MS Office applications such as Database, Macros, V-look up, and Pivot tables, as well as familiarity with company platforms like Business Objects, Workbench, Eagle, Pega, Lombardi, and DRAS.","--- Evaluation Report ---
Job Title: IT Support Specialist

Candidate Fit Level: Not a Good Fit

Strengths:
- The candidate has a background in healthcare as a Medical Technologist, which may provide some familiarity with clinical environments.
- They possess strong communication skills, as evidenced by their experience in conducting client meetings and acting as a liaison between various stakeholders.
- The candidate demonstrates problem-solving abilities and analytical thinking through their experience in financial analysis and reconciliation tasks.

Missing or Weak Areas:
- The candidate lacks specific experience with IT support roles, particularly in providing technical assistance to clinical staff or supporting EMR systems like Epic Systems.
- There is no mention of experience in resolving hardware and software issues, which is a critical aspect of the IT Support Specialist role.
- The candidate does not demonstrate knowledge of networks and databases, which is emphasized in the job description.
- There is no evidence of training end-users in a technical capacity, which is a key responsibility of the role.
- The candidate's experience is primarily in finance and investment, which does not align with the technical support focus required for this position.

---------------------------"
